{
    "$schema": "http://json-schema.org/draft-07/schema#",
    "$comment": "Generated by: https://github.com/friflo/Friflo.Json.Fliox/tree/main/Json/Fliox/Schema",
    "$ref": "#/definitions/Order",
    "definitions": {
        "Order": {
            "type": "object",
            "description": "Some useful docs about an Order :). Test type reference '<b>OrderItem</b>'",
            "properties": {
                "id":       { "type": "string" },
                "customer": { "type": ["string", "null"], "relation": "customers", "description": "Some <b>useful</b> member documentation ðŸ™‚" },
                "created":  { "$ref": "./Standard.json#/definitions/DateTime" },
                "items":    { "type": ["array", "null"], "items": { "$ref": "./UnitTest.Fliox.Client.json#/definitions/OrderItem" } }
            },
            "required": [
                "id",
                "created"
            ],
            "additionalProperties": false
        }
    }
}

