{
    "id": "00000001-4001-0000-0000-000000000000",
    "customer": "00000001-2001-0000-0000-000000000000",
    "created": "2021-07-22T06:00:00.000Z",
    "items": [
        {
            "article": "00000001-1001-0000-0000-000000000000",
            "amount": 1,
            "name": "Camera"
        },
        {
            "article": "00000001-1002-0000-0000-000000000000",
            "amount": 2,
            "name": "Smartphone"
        },
        {
            "article": "00000001-1001-0000-0000-000000000000",
            "amount": 3,
            "name": "Camera"
        }
    ]
}